{
  "schema_version": "1.0",
  "signal_type": "blocker",
  "blocker_id": "B-002",
  "type": "design-approval-needed",
  "severity": "blocks-phase",
  "description": "Phase 2b complete — Figma file 'Acme Precision Design System' is ready for review. Approve to unlock Phase 2c (lock & extract), or comment specific frames to iterate.",
  "options": [
    {
      "id": "approve",
      "label": "Approve as-is",
      "consequence": "Locks the Figma file and starts token + components-manifest extraction."
    },
    {
      "id": "iterate",
      "label": "Request iteration",
      "preview": "Free-form notes captured below; figma-designer will rerun on the affected frames only.",
      "consequence": "Re-spawns figma-designer with scoped feedback; expected +1500-3000 tokens."
    },
    {
      "id": "redirect",
      "label": "Pick different direction",
      "consequence": "Returns to Phase 2a; previous Figma file archived (not deleted)."
    }
  ],
  "context_files": [
    ".factory-state/artifacts/design/directions.json",
    ".factory-state/artifacts/design/chosen-direction.txt",
    ".factory-state/artifacts/design/figma-link.txt"
  ],
  "raised_by": "figma-designer",
  "created_at": "2026-04-26T17:32:00Z",
  "phase": "design"
}
